[
  {
    "sourceId": "brookings-article",
    "url": "https://www.brookings.edu/articles/financing-the-ai-buildout/",
    "resolvedURL": null,
    "publisher": "Brookings Institution",
    "title": "Financing the AI buildout",
    "sourceType": "SECONDARY_RESEARCH",
    "primaryOrSecondary": "SECONDARY",
    "documentDate": "2026-09-23",
    "modifiedAt": null,
    "availableFrom": "2026-09-23",
    "availabilityBasis": "DATED_DISCLOSURE_RECONSTRUCTION_NOT_REAL_TIME_VINTAGE",
    "retrievedAt": "2026-10-07T22:04:06.895Z",
    "MIME": null,
    "byteSize": 0,
    "sourceHash": null,
    "sourceVersion": "brookings-article@WEB_REVIEW_20261007",
    "qualificationStatus": "WEB_REVIEWED_NOT_ARCHIVED",
    "retrievalStatus": "REVIEW_REQUIRED",
    "accessError": "CONTENT_MISMATCH",
    "reviewMethod": "Public web text review; raw retrieval not qualified",
    "allowedRoutes": [
      {
        "host": "www.brookings.edu",
        "prefix": "/"
      }
    ],
    "sourceFamilyId": "brookings-article",
    "previousSourceVersion": null
  },
  {
    "sourceId": "brookings-paper",
    "url": "https://www.brookings.edu/wp-content/uploads/2026/09/4c_Van-Nieuwerburgh.pdf",
    "resolvedURL": "https://www.brookings.edu/wp-content/uploads/2026/09/4c_Van-Nieuwerburgh.pdf",
    "publisher": "Stijn Van Nieuwerburgh / Brookings",
    "title": "Financing the AI Buildout, BPEA conference draft",
    "sourceType": "SECONDARY_RESEARCH",
    "primaryOrSecondary": "SECONDARY",
    "documentDate": "2026-09-04",
    "modifiedAt": null,
    "availableFrom": "2026-09-04",
    "availabilityBasis": "DATED_DISCLOSURE_RECONSTRUCTION_NOT_REAL_TIME_VINTAGE",
    "retrievedAt": "2026-10-07T22:04:08.169Z",
    "MIME": "application/pdf",
    "byteSize": 991052,
    "sourceHash": "bf96f1e528b10dcd8cb1ab52bfad45f100efa1d7462b2af75f9bb4bda668bbc4",
    "sourceVersion": "brookings-paper@bf96f1e528b10dcd8cb1ab52bfad45f100efa1d7462b2af75f9bb4bda668bbc4",
    "qualificationStatus": "ARCHIVED_REVIEWED",
    "retrievalStatus": "REVIEW_REQUIRED",
    "accessError": null,
    "reviewMethod": "Agent-assisted issuer/period/section review; raw identity hash verified",
    "allowedRoutes": [
      {
        "host": "www.brookings.edu",
        "prefix": "/"
      }
    ],
    "sourceFamilyId": "brookings-paper",
    "previousSourceVersion": null
  },
  {
    "sourceId": "meta-jv",
    "url": "https://investor.atmeta.com/investor-news/press-release-details/2025/Meta-Announces-Joint-Venture-with-Funds-Managed-by-Blue-Owl-Capital-to-Develop-Hyperion-Data-Center/",
    "resolvedURL": null,
    "publisher": "Meta Platforms",
    "title": "Hyperion joint venture announcement",
    "sourceType": "PRIMARY_TRANSACTION",
    "primaryOrSecondary": "PRIMARY",
    "documentDate": "2025-10-21",
    "modifiedAt": null,
    "availableFrom": "2025-10-21",
    "availabilityBasis": "DATED_DISCLOSURE_RECONSTRUCTION_NOT_REAL_TIME_VINTAGE",
    "retrievedAt": "2026-10-07T22:04:09.559Z",
    "MIME": null,
    "byteSize": 0,
    "sourceHash": null,
    "sourceVersion": "meta-jv@WEB_REVIEW_20261007",
    "qualificationStatus": "UNQUALIFIED",
    "retrievalStatus": "ACCESS_BLOCKED",
    "accessError": "ACCESS_BLOCKED",
    "reviewMethod": "Public web text review; raw retrieval not qualified",
    "allowedRoutes": [
      {
        "host": "investor.atmeta.com",
        "prefix": "/"
      }
    ],
    "sourceFamilyId": "meta-jv",
    "previousSourceVersion": null
  },
  {
    "sourceId": "meta-2025k",
    "url": "https://www.sec.gov/Archives/edgar/data/1326801/000162828026003942/meta-20251231.htm",
    "resolvedURL": null,
    "publisher": "Meta Platforms",
    "title": "2025 Form 10-K",
    "sourceType": "PRIMARY_ACCOUNTING",
    "primaryOrSecondary": "PRIMARY",
    "documentDate": "2026-01-29",
    "modifiedAt": null,
    "availableFrom": "2026-01-29",
    "availabilityBasis": "DATED_DISCLOSURE_RECONSTRUCTION_NOT_REAL_TIME_VINTAGE",
    "retrievedAt": "2026-10-07T22:04:10.822Z",
    "MIME": null,
    "byteSize": 0,
    "sourceHash": null,
    "sourceVersion": "meta-2025k@WEB_REVIEW_20261007",
    "qualificationStatus": "WEB_REVIEWED_NOT_ARCHIVED",
    "retrievalStatus": "ACCESS_BLOCKED",
    "accessError": "ACCESS_BLOCKED",
    "reviewMethod": "Public web text review; raw retrieval not qualified",
    "allowedRoutes": [
      {
        "host": "www.sec.gov",
        "prefix": "/"
      }
    ],
    "sourceFamilyId": "meta-2025k",
    "previousSourceVersion": null
  },
  {
    "sourceId": "meta-2026q2",
    "url": "https://www.sec.gov/Archives/edgar/data/1326801/000162828026050705/meta-20260630.htm",
    "resolvedURL": null,
    "publisher": "Meta Platforms",
    "title": "2026 Q2 Form 10-Q",
    "sourceType": "PRIMARY_ACCOUNTING",
    "primaryOrSecondary": "PRIMARY",
    "documentDate": "2026-07-30",
    "modifiedAt": null,
    "availableFrom": "2026-07-30",
    "availabilityBasis": "DATED_DISCLOSURE_RECONSTRUCTION_NOT_REAL_TIME_VINTAGE",
    "retrievedAt": "2026-10-07T22:04:12.127Z",
    "MIME": null,
    "byteSize": 0,
    "sourceHash": null,
    "sourceVersion": "meta-2026q2@WEB_REVIEW_20261007",
    "qualificationStatus": "WEB_REVIEWED_NOT_ARCHIVED",
    "retrievalStatus": "ACCESS_BLOCKED",
    "accessError": "ACCESS_BLOCKED_HOST_STOP",
    "reviewMethod": "Public web text review; raw retrieval not qualified",
    "allowedRoutes": [
      {
        "host": "www.sec.gov",
        "prefix": "/"
      }
    ],
    "sourceFamilyId": "meta-2026q2",
    "previousSourceVersion": null
  },
  {
    "sourceId": "cc-pimco",
    "url": "https://www.cliffordchance.com/news/news/2025/10/clifford-chance-advises-pimco-funds-on-investment-to-develop-metas-hyperion-data-center.html",
    "resolvedURL": "https://www.cliffordchance.com/news/news/2025/10/clifford-chance-advises-pimco-funds-on-investment-to-develop-metas-hyperion-data-center.html",
    "publisher": "Clifford Chance",
    "title": "PIMCO investment to develop Hyperion",
    "sourceType": "PRIMARY_TRANSACTION",
    "primaryOrSecondary": "PRIMARY",
    "documentDate": "2025-10-27",
    "modifiedAt": null,
    "availableFrom": "2025-10-27",
    "availabilityBasis": "DATED_DISCLOSURE_RECONSTRUCTION_NOT_REAL_TIME_VINTAGE",
    "retrievedAt": "2026-10-07T22:04:13.230Z",
    "MIME": "text/html",
    "byteSize": 247566,
    "sourceHash": "bf5d7ba6ad5abb85e13d61504b73da27806aad0422b04ebcdd146fc9a4d2f65e",
    "sourceVersion": "cc-pimco@bf5d7ba6ad5abb85e13d61504b73da27806aad0422b04ebcdd146fc9a4d2f65e",
    "qualificationStatus": "ARCHIVED_REVIEWED",
    "retrievalStatus": "CONTENT_VALIDATED",
    "accessError": null,
    "reviewMethod": "Agent-assisted issuer/period/section review; raw identity hash verified",
    "allowedRoutes": [
      {
        "host": "www.cliffordchance.com",
        "prefix": "/"
      }
    ],
    "sourceFamilyId": "cc-pimco",
    "previousSourceVersion": null
  },
  {
    "sourceId": "meta-engineering",
    "url": "https://engineering.fb.com/2025/09/29/data-infrastructure/metas-infrastructure-evolution-and-the-advent-of-ai/",
    "resolvedURL": "https://engineering.fb.com/2025/09/29/data-infrastructure/metas-infrastructure-evolution-and-the-advent-of-ai/",
    "publisher": "Meta Engineering",
    "title": "Infrastructure evolution and AI",
    "sourceType": "PRIMARY_PROJECT",
    "primaryOrSecondary": "PRIMARY",
    "documentDate": "2025-09-29",
    "modifiedAt": null,
    "availableFrom": "2025-09-29",
    "availabilityBasis": "DATED_DISCLOSURE_RECONSTRUCTION_NOT_REAL_TIME_VINTAGE",
    "retrievedAt": "2026-10-07T22:04:15.391Z",
    "MIME": "text/html",
    "byteSize": 133318,
    "sourceHash": "c93b2e23bd2c3cfcadb5fb98deb417c1623c67407237343086dea2f325b47076",
    "sourceVersion": "meta-engineering@c93b2e23bd2c3cfcadb5fb98deb417c1623c67407237343086dea2f325b47076",
    "qualificationStatus": "ARCHIVED_REVIEWED",
    "retrievalStatus": "CONTENT_VALIDATED",
    "accessError": null,
    "reviewMethod": "Agent-assisted issuer/period/section review; raw identity hash verified",
    "allowedRoutes": [
      {
        "host": "engineering.fb.com",
        "prefix": "/"
      }
    ],
    "sourceFamilyId": "meta-engineering",
    "previousSourceVersion": null
  },
  {
    "sourceId": "meta-expansion",
    "url": "https://about.fb.com/news/2026/07/teachers-local-businesses-win-as-meta-expands-louisiana-data-center/",
    "resolvedURL": "https://about.fb.com/news/2026/07/teachers-local-businesses-win-as-meta-expands-louisiana-data-center/",
    "publisher": "Meta",
    "title": "Louisiana data center expansion",
    "sourceType": "PRIMARY_PROJECT",
    "primaryOrSecondary": "PRIMARY",
    "documentDate": "2026-07-13",
    "modifiedAt": null,
    "availableFrom": "2026-07-13",
    "availabilityBasis": "DATED_DISCLOSURE_RECONSTRUCTION_NOT_REAL_TIME_VINTAGE",
    "retrievedAt": "2026-10-07T22:04:16.671Z",
    "MIME": "text/html",
    "byteSize": 383724,
    "sourceHash": "eeab6bdf49ccf9875114d30a14cf7118aacb41675c7a287c476cd417d439f1ff",
    "sourceVersion": "meta-expansion@eeab6bdf49ccf9875114d30a14cf7118aacb41675c7a287c476cd417d439f1ff",
    "qualificationStatus": "ARCHIVED_REVIEWED",
    "retrievalStatus": "CONTENT_VALIDATED",
    "accessError": null,
    "reviewMethod": "Agent-assisted issuer/period/section review; raw identity hash verified",
    "allowedRoutes": [
      {
        "host": "about.fb.com",
        "prefix": "/"
      }
    ],
    "sourceFamilyId": "meta-expansion",
    "previousSourceVersion": null
  },
  {
    "sourceId": "entergy-substation",
    "url": "https://www.entergy.com/news/entergy-louisiana-breaks-ground-on-key-substation-to-power-data-center-in-richland-parish",
    "resolvedURL": "https://www.entergy.com/news/entergy-louisiana-breaks-ground-on-key-substation-to-power-data-center-in-richland-parish",
    "publisher": "Entergy Louisiana",
    "title": "Smalling Substation groundbreaking",
    "sourceType": "PRIMARY_PROJECT",
    "primaryOrSecondary": "PRIMARY",
    "documentDate": "2025-06-27",